{
  "name": "Port Said",
  "country": "Egypt",
  "type": "commercial",
  "location": {
    "lat": 31.265,
    "lon": 32.302
  },
  "nearest_city": "Port Said",
  "operator": "Suez Canal Authority",
  "max_ship_length_m": 400,
  "max_ship_beam_m": 60,
  "max_draught_m": 16,
  "berth_depth_m": 16,
  "channel_depth_m": 16,
  "carrier_capable": "limited",
  "notes": "Mediterranean entrance to the Suez Canal; carrier access depends on berth assignment and canal constraints.",
  "wikipedia_url": "https://en.wikipedia.org/wiki/Port_Said"
}
