{
  "name": "Jebel Ali Port",
  "country": "United Arab Emirates",
  "type": "commercial",
  "location": {
    "lat": 25.011,
    "lon": 55.061
  },
  "nearest_city": "Dubai",
  "operator": "DP World",
  "max_ship_length_m": 400,
  "max_ship_beam_m": 60,
  "max_draught_m": 17,
  "berth_depth_m": 17,
  "channel_depth_m": 17,
  "carrier_capable": "yes",
  "notes": "Large deep-water port with extensive alongside capacity; frequent naval logistics calls.",
  "wikipedia_url": "https://en.wikipedia.org/wiki/Jebel_Ali"
}
